{
  "registry_version": "system-backup-metrics-alerts.v1",
  "contract_version": "system-backup-plan.v12",
  "status": "draft",
  "source": {
    "plan": "docs/system-backup-restore-division-plan.md",
    "section": "15",
    "metric_count": 210,
    "alert_count": 100
  },
  "metrics": [
    {
      "name": "clawmanager_system_backup_task_transitions_total",
      "type": "counter",
      "help": "Total number of system backup task transitions observations.",
      "labels": [
        "task_type",
        "task_purpose",
        "status"
      ],
      "aggregation": "sum",
      "no_data": "zero",
      "buckets": []
    },
    {
      "name": "clawmanager_system_backup_tasks_current",
      "type": "gauge",
      "help": "Current system backup tasks current value using the declared bounded labels.",
      "labels": [
        "task_type",
        "task_purpose",
        "status"
      ],
      "aggregation": "sum",
      "no_data": "zero",
      "buckets": []
    },
    {
      "name": "clawmanager_system_backup_task_status_duration_seconds",
      "type": "histogram",
      "help": "Observed system backup task status duration in seconds.",
      "labels": [
        "task_type",
        "task_purpose",
        "status"
      ],
      "aggregation": "observe",
      "no_data": "not_emitted",
      "buckets": [
        0.1,
        0.5,
        1,
        2.5,
        5,
        10,
        30,
        60,
        300,
        900,
        1800,
        3600,
        7200,
        21600
      ]
    },
    {
      "name": "clawmanager_system_backup_task_queue_age_seconds",
      "type": "gauge",
      "help": "Current system backup task queue age value in seconds.",
      "labels": [
        "task_type",
        "task_purpose"
      ],
      "aggregation": "max",
      "no_data": "zero",
      "buckets": []
    },
    {
      "name": "clawmanager_system_backup_task_stuck",
      "type": "gauge",
      "help": "Current system backup task stuck value using the declared bounded labels.",
      "labels": [
        "task_type",
        "task_purpose"
      ],
      "aggregation": "boolean",
      "no_data": "zero",
      "buckets": []
    },
    {
      "name": "clawmanager_system_backup_operation_queue_age_seconds",
      "type": "gauge",
      "help": "Current system backup operation queue age value in seconds.",
      "labels": [
        "operation_type"
      ],
      "aggregation": "max",
      "no_data": "zero",
      "buckets": []
    },
    {
      "name": "clawmanager_system_backup_operations_stuck",
      "type": "gauge",
      "help": "Current system backup operations stuck value using the declared bounded labels.",
      "labels": [
        "operation_type"
      ],
      "aggregation": "boolean",
      "no_data": "zero",
      "buckets": []
    },
    {
      "name": "clawmanager_system_backup_queue_rejections_total",
      "type": "counter",
      "help": "Total number of system backup queue rejections observations.",
      "labels": [
        "task_type",
        "failure_category"
      ],
      "aggregation": "sum",
      "no_data": "zero",
      "buckets": []
    },
    {
      "name": "clawmanager_system_backup_eligibility_decisions_total",
      "type": "counter",
      "help": "Total number of system backup eligibility decisions observations.",
      "labels": [
        "task_type",
        "task_purpose",
        "metric_result",
        "failure_category"
      ],
      "aggregation": "sum",
      "no_data": "zero",
      "buckets": []
    },
    {
      "name": "clawmanager_system_backup_capture_hold_seconds",
      "type": "histogram",
      "help": "Observed system backup capture hold in seconds.",
      "labels": [
        "profile",
        "runner"
      ],
      "aggregation": "observe",
      "no_data": "not_emitted",
      "buckets": [
        0.1,
        0.5,
        1,
        2.5,
        5,
        10,
        30,
        60,
        300,
        900,
        1800,
        3600,
        7200,
        21600
      ]
    },
    {
      "name": "clawmanager_system_backup_capture_hold_current_seconds",
      "type": "gauge",
      "help": "Current system backup capture hold current value in seconds.",
      "labels": [
        "profile",
        "runner"
      ],
      "aggregation": "max",
      "no_data": "zero",
      "buckets": []
    },
    {
      "name": "clawmanager_system_backup_gate_state",
      "type": "gauge",
      "help": "Current system backup gate state value using the declared bounded labels.",
      "labels": [
        "profile",
        "gate_state"
      ],
      "aggregation": "boolean",
      "no_data": "zero",
      "buckets": []
    },
    {
      "name": "clawmanager_system_backup_gate_wait_seconds",
      "type": "histogram",
      "help": "Observed system backup gate wait in seconds.",
      "labels": [
        "profile",
        "gate_state"
      ],
      "aggregation": "observe",
      "no_data": "not_emitted",
      "buckets": [
        0.1,
        0.5,
        1,
        2.5,
        5,
        10,
        30,
        60,
        300,
        900,
        1800,
        3600,
        7200,
        21600
      ]
    },
    {
      "name": "clawmanager_system_backup_gate_wait_current_seconds",
      "type": "gauge",
      "help": "Current system backup gate wait current value in seconds.",
      "labels": [
        "profile"
      ],
      "aggregation": "max",
      "no_data": "zero",
      "buckets": []
    },
    {
      "name": "clawmanager_system_backup_mutation_leases_current",
      "type": "gauge",
      "help": "Current system backup mutation leases current value using the declared bounded labels.",
      "labels": [
        "operation_type"
      ],
      "aggregation": "sum",
      "no_data": "zero",
      "buckets": []
    },
    {
      "name": "clawmanager_system_backup_mutation_lease_blockers_current",
      "type": "gauge",
      "help": "Current system backup mutation lease blockers current value using the declared bounded labels.",
      "labels": [
        "operation_type"
      ],
      "aggregation": "sum",
      "no_data": "zero",
      "buckets": []
    },
    {
      "name": "clawmanager_system_backup_mutation_lease_oldest_age_seconds",
      "type": "gauge",
      "help": "Current system backup mutation lease oldest age value in seconds.",
      "labels": [
        "operation_type"
      ],
      "aggregation": "max",
      "no_data": "zero",
      "buckets": []
    },
    {
      "name": "clawmanager_system_backup_mutation_lease_failures_total",
      "type": "counter",
      "help": "Total number of system backup mutation lease failures observations.",
      "labels": [
        "operation_type",
        "failure_category"
      ],
      "aggregation": "sum",
      "no_data": "zero",
      "buckets": []
    },
    {
      "name": "clawmanager_system_backup_participant_state",
      "type": "gauge",
      "help": "Current system backup participant state value using the declared bounded labels.",
      "labels": [
        "participant_state"
      ],
      "aggregation": "boolean",
      "no_data": "zero",
      "buckets": []
    },
    {
      "name": "clawmanager_system_backup_participant_transition_seconds",
      "type": "histogram",
      "help": "Observed system backup participant transition in seconds.",
      "labels": [
        "participant_state"
      ],
      "aggregation": "observe",
      "no_data": "not_emitted",
      "buckets": [
        0.01,
        0.05,
        0.1,
        0.25,
        0.5,
        1,
        2.5,
        5,
        10,
        30,
        60,
        300
      ]
    },
    {
      "name": "clawmanager_system_backup_participant_heartbeat_age_seconds",
      "type": "gauge",
      "help": "Current system backup participant heartbeat age value in seconds.",
      "labels": [
        "participant_state"
      ],
      "aggregation": "max",
      "no_data": "zero",
      "buckets": []
    },
    {
      "name": "clawmanager_system_backup_participant_heartbeat_failures_total",
      "type": "counter",
      "help": "Total number of system backup participant heartbeat failures observations.",
      "labels": [
        "failure_category"
      ],
      "aggregation": "sum",
      "no_data": "zero",
      "buckets": []
    },
    {
      "name": "clawmanager_system_backup_participant_resume_failures_total",
      "type": "counter",
      "help": "Total number of system backup participant resume failures observations.",
      "labels": [
        "failure_category"
      ],
      "aggregation": "sum",
      "no_data": "zero",
      "buckets": []
    },
    {
      "name": "clawmanager_system_backup_participant_forced_resume_total",
      "type": "counter",
      "help": "Total number of system backup participant forced resume observations.",
      "labels": [],
      "aggregation": "sum",
      "no_data": "zero",
      "buckets": []
    },
    {
      "name": "clawmanager_system_backup_controller_leader_changes_total",
      "type": "counter",
      "help": "Total number of system backup controller leader changes observations.",
      "labels": [],
      "aggregation": "sum",
      "no_data": "zero",
      "buckets": []
    },
    {
      "name": "clawmanager_system_backup_controller_reconcile_total",
      "type": "counter",
      "help": "Total number of system backup controller reconcile observations.",
      "labels": [
        "metric_result"
      ],
      "aggregation": "sum",
      "no_data": "zero",
      "buckets": []
    },
    {
      "name": "clawmanager_system_backup_controller_reconcile_seconds",
      "type": "histogram",
      "help": "Observed system backup controller reconcile in seconds.",
      "labels": [
        "metric_result"
      ],
      "aggregation": "observe",
      "no_data": "not_emitted",
      "buckets": [
        0.01,
        0.05,
        0.1,
        0.25,
        0.5,
        1,
        2.5,
        5,
        10,
        30,
        60,
        300
      ]